{
  "meta": {
    "job_id": "job_0002",
    "created_at": "2026-01-02T20:00:00+03:00",
    "timezone": "Россия",
    "schema_version": "1.0",
    "notes": ""
  },
  "input": {
    "mode": "structured",
    "payload": {
      "topic": "Озноб",
      "clinic": {
        "name": "Клиника Фомина"
      },
      "page_type": "disease",
      "target_url": "https://fomin-clinic.ru/zabolevaniya/oznob/",
      "competitors": [
        "https://www.invitro.ru/library/simptomy/26363/",
        "https://www.fdoctor.ru/simptom/oznob/",
        "https://www.krasotaimedicina.ru/symptom/thermoregulation/chills",
        "https://www.medprosvet.spb.ru/article/oznob-bez-temperatury-zyabkost-prichiny-diagnostika-lechenie",
        "https://cold-flu.ru/blog/oznob/",
        "https://www.onclinic-ryazan.ru/chills/",
        "https://teledoctor24.ru/article/95-oznob-bez-temperatury/",
        "https://premium-clinic.ru/oznob-bez-temperatury-prichiny-vozniknoveniya/",
        "https://megapteka.ru/specials/chto-delat-pri-4302",
        "https://mc21.ru/articles/oznob/",
        "https://doct.ru/diseases/oznob.html"
      ],
      "keywords": [
        "сильный озноб",
        "озноб",
        "морозит",
        "озноб причины",
        "озноб симптомы",
        "озноб без температуры"
      ],
      "lsi": [
        "температуры",
        "причины",
        "симптомы",
        "тела",
        "возникает",
        "организма",
        "повышения"
      ],
      "anti_cannibalization_urls": [
        "https://fomin-clinic.ru/zabolevaniya/orvi/",
        "https://fomin-clinic.ru/zabolevaniya/gripp/",
        "https://fomin-clinic.ru/blog/temperatura-bez-simptomov-kogda-stoit-idti-k-vrachu/",
        "https://fomin-clinic.ru/blog/profilaktika-orvi-i-sezonnykh-zabolevaniy/",
        "https://fomin-clinic.ru/doctors/terapevt/"
      ]
    },
    "constraints": {
      "language": "ru",
      "region": "RU",
      "mode": "Search",
      "artifact_types": [
        "structure_spec"
      ],
      "formatting_rules": [
        "Strict JSON",
        "Explicit H1/H2/H3 fields (no Markdown rendering)",
        "Без эмодзи",
        "Без воды",
        "Учитывать YMYL и медицинскую осторожность формулировок"
      ]
    }
  },
  "passes": {
    "decide": {
      "status": "PASS",
      "started_at": "2026-01-04T00:00:00+03:00",
      "ended_at": "2026-01-04T00:00:00+03:00",
      "input_ref": "jobs/job_0002/input",
      "output_ref": "jobs/job_0002/output",
      "architecture_decision_json": {
        "pass": "DECIDE",
        "immutable_snapshot": {
          "status": "LOCKED",
          "reason": "Input is complete; scope, constraints, and verification conditions are fully defined for producing a strict-JSON structure_spec."
        },
        "scope": {
          "what_in": [
            "Strict JSON structure_spec (machine-checkable)",
            "Explicit H1/H2/H3 fields (no Markdown rendering)",
            "Section purposes and must_cover constraints",
            "Keyword + LSI mapping per section",
            "Internal linking list (anchors + URLs) without implementing links",
            "YMYL safety: structural placement for 'when to see a doctor' and clinical caution"
          ],
          "what_out": [
            "Full article text generation",
            "Meta title/description generation",
            "Image selection or alt-text creation",
            "Treatment instructions or self-medication guidance",
            "Changing topic or page_type"
          ]
        },
        "output_spec": {
          "artifact_types": ["structure_spec"],
          "formatting_rules": [
            "Strict JSON",
            "Explicit H1/H2/H3 fields (no Markdown rendering)",
            "No emojis",
            "No fluff",
            "Russian language",
            "Professional medical tone"
          ]
        },
        "verification_plan": {
          "what_verify": [
            "All provided keywords are mapped in keyword_coverage with section references",
            "All provided LSI are mapped in lsi_coverage with section references",
            "A dedicated section equivalent to 'Когда необходимо обратиться к врачу' exists",
            "Anti-cannibalization respected",
            "No forbidden outputs"
          ],
          "failure_conditions": [
            "Missing coverage of 'озноб без температуры'",
            "Missing 'when to see a doctor' section",
            "Any treatment instructions",
            "Keyword stuffing in headings"
          ]
        },
        "patch_policy": {
          "allowed_changes": [
            "Refinement of section wording",
            "Redistribution of keywords/LSI",
            "Adding missing mandatory section"
          ],
          "forbidden_changes": [
            "Changing topic",
            "Removing YMYL safeguards",
            "Replacing JSON with prose",
            "Removing anti-cannibalization constraints"
          ]
        }
      },
      "errors": []
    },
    "execute": {
      "status": "PASS",
      "started_at": "2026-01-04T00:10:00+03:00",
      "ended_at": "2026-01-04T00:10:00+03:00",
      "input_ref": "jobs/job_0002/input",
      "output_ref": "jobs/job_0002/output",
      "result": {
        "artifact_ref": "jobs/job_0002/output/pass_2_execute__out.json"
      },
      "errors": []
    },
    "verify": {
      "status": "PASS",
      "started_at": "2026-01-04T00:20:00+03:00",
      "ended_at": "2026-01-04T00:20:00+03:00",
      "input_ref": "jobs/job_0002/input",
      "output_ref": "jobs/job_0002/output",
      "issues": [],
      "errors": []
    },
    "patch": {
      "status": "NOT_RUN",
      "started_at": "2026-01-02T20:00:00+03:00",
      "ended_at": "2026-01-02T20:00:00+03:00",
      "input_ref": "jobs/job_0002/input",
      "output_ref": "jobs/job_0002/output",
      "patch_plan": [],
      "errors": []
    }
  },
  "immutable_snapshot": {
    "status": "LOCKED",
    "hash": "decide0002",
    "locked_at": "2026-01-04T00:00:00+03:00",
    "source_pass": "decide"
  },
  "status": {
    "phase": "VERIFY",
    "run_state": "COMPLETED",
    "last_updated_at": "2026-01-04T00:20:00+03:00"
  }
}
