{
  "meta": {
    "job_id": "job_0001",
    "created_at": "2026-01-02T19:50:00+03:00",
    "timezone": "Europe/Podgorica",
    "schema_version": "1.0",
    "notes": ""
  },
  "input": {
    "mode": "text",
    "payload": {
      "text": ""
    },
    "constraints": {}
  },
  "passes": {
    "decide": {
      "status": "NOT_RUN",
      "started_at": "2026-01-02T19:50:00+03:00",
      "ended_at": "2026-01-02T19:50:00+03:00",
      "input_ref": "jobs/job_0001/input",
      "output_ref": "jobs/job_0001/output",
      "architecture_decision_json": {},
      "errors": []
    },
    "execute": {
      "status": "NOT_RUN",
      "started_at": "2026-01-02T19:50:00+03:00",
      "ended_at": "2026-01-02T19:50:00+03:00",
      "input_ref": "jobs/job_0001/input",
      "output_ref": "jobs/job_0001/output",
      "errors": []
    },
    "verify": {
      "status": "NOT_RUN",
      "started_at": "2026-01-02T19:50:00+03:00",
      "ended_at": "2026-01-02T19:50:00+03:00",
      "input_ref": "jobs/job_0001/input",
      "output_ref": "jobs/job_0001/output",
      "issues": [],
      "errors": []
    },
    "patch": {
      "status": "NOT_RUN",
      "started_at": "2026-01-02T19:50:00+03:00",
      "ended_at": "2026-01-02T19:50:00+03:00",
      "input_ref": "jobs/job_0001/input",
      "output_ref": "jobs/job_0001/output",
      "patch_plan": [],
      "errors": []
    }
  },
  "immutable_snapshot": {
    "status": "UNLOCKED",
    "hash": "pending",
    "locked_at": "2026-01-02T19:50:00+03:00",
    "source_pass": "decide"
  },
  "status": {
    "phase": "DECIDE",
    "run_state": "NOT_STARTED",
    "last_updated_at": "2026-01-02T19:50:00+03:00"
  }
}
